name,email,phone,address,other_info
Akmenės-Joniškio rinkimų apygarda Nr. 39,,,,
Aleksoto-Vilijampolės rinkimų apygarda Nr. 12,,,,
Alytaus rinkimų apygarda Nr. 30,,,,
Antakalnio rinkimų apygarda Nr. 3,,,,
Anykščių-Kupiškio rinkimų apygarda Nr. 49,,,,
Aukštaitijos rinkimų apygarda Nr. 28,,,,
Aušros rinkimų apygarda Nr. 23,,,,
Baltijos rinkimų apygarda Nr. 20,,,,
Biržų-Kupiškio rinkimų apygarda Nr. 48,,,,
Centro rinkimų apygarda Nr. 13,,,,
Dainavos rinkimų apygarda Nr. 16,,,,
Dainų rinkimų apygarda Nr. 25,,,,
Danės rinkimų apygarda Nr. 19,,,,
Dzūkijos rinkimų apygarda Nr. 69,,,,
Fabijoniškių rinkimų apygarda Nr. 5,,,,
Gargždų rinkimų apygarda Nr. 31,,,,
Ignalinos-Švenčionių rinkimų apygarda Nr. 53,,,,
Išrinktas pagal sąrašą,,,,
Jonavos rinkimų apygarda Nr. 60,,,,
Jurbarko rinkimų apygarda Nr. 62,,,,
Justiniškių rinkimų apygarda Nr. 7,,,,
Kaišiadorių-Elektrėnų rinkimų apygarda Nr. 59,,,,
Kalniečių rinkimų apygarda Nr. 15,,,,
Karoliniškių rinkimų apygarda Nr. 8,,,,
Kauno kaimiškoji rinkimų apygarda Nr. 66,,,,
Kauno-Kėdainių rinkimų apygarda Nr. 65,,,,
Kelmės rinkimų apygarda Nr. 41,,,,
Kretingos rinkimų apygarda Nr. 36,,,,
Kėdainių rinkimų apygarda Nr. 43,,,,
Lazdijų-Druskininkų rinkimų apygarda Nr. 71,,,,
Lazdynų rinkimų apygarda Nr. 9,,,,
Marijampolės rinkimų apygarda Nr. 29,,,,
Marių rinkimų apygarda Nr. 21,,,,
Mažeikių rinkimų apygarda Nr. 38,,,,
Molėtų-Švenčionių rinkimų apygarda Nr. 54,,,,
Naujamiesčio rinkimų apygarda Nr. 1,,,,
Naujosios Vilnios rinkimų apygarda Nr. 10,,,,
Nevėžio rinkimų apygarda Nr. 26,,,,
Pajūrio rinkimų apygarda Nr. 22,,,,
Pakruojo-Joniškio rinkimų apygarda Nr. 46,,,,
Panemunės rinkimų apygarda Nr. 18,,,,
Pasvalio-Panevėžio rinkimų apygarda Nr. 47,,,,
Plungės-Rietavo rinkimų apygarda Nr. 35,,,,
Pramonės rinkimų apygarda Nr. 17,,,,
Prienų rinkimų apygarda Nr. 67,,,,
Radviliškio rinkimų apygarda Nr. 44,,,,
Raseinių rinkimų apygarda Nr. 42,,,,
Rokiškio rinkimų apygarda Nr. 50,,,,
Saulės rinkimų apygarda Nr. 24,,,,
Senamiesčio rinkimų apygarda Nr. 2,,,,
Skuodo-Mažeikių rinkimų apygarda Nr. 37,,,,
Suvalkijos rinkimų apygarda Nr. 63,,,,
Tauragės rinkimų apygarda Nr. 34,,,,
Telšių rinkimų apygarda Nr. 40,,,,
Trakų-Elektrėnų rinkimų apygarda Nr. 58,,,,
Ukmergės rinkimų apygarda Nr. 61,,,,
Utenos rinkimų apygarda Nr. 51,,,,
Vakarinė rinkimų apygarda Nr. 27,,,,
Varėnos-Eišiškių rinkimų apygarda Nr. 70,,,,
Vilkaviškio rinkimų apygarda Nr. 68,,,,
Vilniaus-Trakų rinkimų apygarda Nr. 57,,,,
Vilniaus-Šalčininkų rinkimų apygarda Nr. 56,,,,
Zarasų-Visagino rinkimų apygarda Nr. 52,,,,
Šakių rinkimų apygarda Nr. 64,,,,
Šeškinės rinkimų apygarda Nr. 6,,,,
Šiaulių kaimiškoji rinkimų apygarda Nr. 45,,,,
Šilainių rinkimų apygarda Nr. 11,,,,
Šilalės-Šilutės rinkimų apygarda Nr. 33,,,,
Šilutės-Pagėgių rinkimų apygarda Nr. 32,,,,
Širvintų-Vilniaus rinkimų apygarda Nr. 55,,,,
Žaliakalnio rinkimų apygarda Nr. 14,,,,
Žirmūnų rinkimų apygarda Nr. 4,,,,
